{
  "schemaVersion": 1,
  "target": "robinhood-mainnet",
  "chainId": 4663,
  "name": "Robinhood Chain",
  "explorerBase": "https://robinhoodchain.blockscout.com",
  "weth": "0x0Bd7D308f8E1639FAb988df18A8011f41EAcAD73",
  "uniswapV2Factory": "0x8bcEaA40B9AcdfAedF85AdF4FF01F5Ad6517937f",
  "uniswapV2Router02": "0x89e5DB8B5aA49aA85AC63f691524311AEB649eba",
  "pairInitCodeHash": "0x96e8ac4277198ff8b6f785478aa9a39f403cb768dd02cbee326c3e7da348845f",
  "bytecodeHashes": {
    "weth": "0x5706be52f64875fee65a2cec0d80e47a23d8793cbe85d214b48445e2d05f5353",
    "uniswapV2Factory": "0xbab145d02e7005f0d84c6c1639d39b799b0ea16df99ebbdaf5a14d9da820b4e0",
    "uniswapV2Pair": "0x5b83bdbcc56b2e630f2807bbadd2b0c21619108066b92a58de081261089e9ce5"
  },
  "forkVerification": {
    "blockNumber": 53240126,
    "blockHash": "0xa1249b79d3ad41991913b02bb10057156a49fc22ab54ffebec27d05cff5f529a",
    "observedRpcProvider": "Robinhood Public RPC",
    "archiveRpcProvider": "Alchemy",
    "rpcEnvironmentVariable": "ROBINHOOD_MAINNET_ARCHIVE_RPC_URL",
    "archiveRequired": true
  },
  "sources": {
    "chainContracts": "https://docs.robinhood.com/chain/contracts/",
    "chainRpc": "https://docs.robinhood.com/chain/connecting/",
    "uniswapV2Deployments": "https://developers.uniswap.org/docs/protocols/v2/deployments",
    "pairInitCodeHash": "https://github.com/Uniswap/v2-periphery/blob/master/contracts/libraries/UniswapV2Library.sol"
  }
}
